{"formatVersion":2,"files":{"presentations/example.py":"from execute_util import callout, code, diff, notes, section, text\n\n\nBEFORE = \"\"\"def load_cart(user_id):\n    with LOCK:\n        cached = cache.get(user_id)\n        if cached is None:\n            cached = hydrate(user_id)\n            cache.set(user_id, cached)\n        return cached\n\"\"\"\n\nAFTER = \"\"\"def load_cart(user_id):\n    cached = cache.get(user_id)\n    if cached is not None:\n        return cached\n    with lock_for(user_id):\n        cached = cache.get(user_id)\n        if cached is None:\n            cached = hydrate(user_id)\n            cache.set(user_id, cached)\n        return cached\n\"\"\"\n\n\ndef main():\n    text(\"# Checkout timeouts\")\n    notes(\"Share the presenter URL. This overlay is only for you.\")\n    text(\"Friday deploy. Checkout p95 jumped from 240 ms to 4.1 s. Payments stayed healthy.\")\n\n    section(\"Symptom\", \"Only checkout, only after the cache change\")\n    callout(\"Health checks stayed green. The queue grew behind one process-wide lock.\", tone=\"danger\")\n    notes(\"Pause. Ask if anyone has seen a green probe hide a lock.\")\n\n    section(\"Hypothesis\", \"A cache miss serialized every cart\")\n    code(BEFORE, \"python\")\n    text(\"The lock wrapped the read and the fill. The first miss blocked everyone else.\")\n    notes(\"Keep long samples in constants so audience line numbers stay clean.\")\n\n    section(\"Fix\", \"Lock only the fill, and only per key\")\n    diff(BEFORE, AFTER, \"python\")\n    callout(\"p95 returned to 220 ms. Step with the keys or the bottom scrubber.\", tone=\"success\")\n"},"frames":[{"path":"presentations/example.py","line_number":27,"function_name":"main","code":"    text(\"# Checkout timeouts\")","invocation_id":0},{"path":"presentations/example.py","line_number":29,"function_name":"main","code":"    text(\"Friday deploy. Checkout p95 jumped from 240 ms to 4.1 s. Payments stayed healthy.\")","invocation_id":0},{"path":"presentations/example.py","line_number":31,"function_name":"main","code":"    section(\"Symptom\", \"Only checkout, only after the cache change\")","invocation_id":0},{"path":"presentations/example.py","line_number":32,"function_name":"main","code":"    callout(\"Health checks stayed green. The queue grew behind one process-wide lock.\", tone=\"danger\")","invocation_id":0},{"path":"presentations/example.py","line_number":35,"function_name":"main","code":"    section(\"Hypothesis\", \"A cache miss serialized every cart\")","invocation_id":0},{"path":"presentations/example.py","line_number":36,"function_name":"main","code":"    code(BEFORE, \"python\")","invocation_id":0},{"path":"presentations/example.py","line_number":37,"function_name":"main","code":"    text(\"The lock wrapped the read and the fill. The first miss blocked everyone else.\")","invocation_id":0},{"path":"presentations/example.py","line_number":40,"function_name":"main","code":"    section(\"Fix\", \"Lock only the fill, and only per key\")","invocation_id":0},{"path":"presentations/example.py","line_number":41,"function_name":"main","code":"    diff(BEFORE, AFTER, \"python\")","invocation_id":0},{"path":"presentations/example.py","line_number":42,"function_name":"main","code":"    callout(\"p95 returned to 220 ms. Step with the keys or the bottom scrubber.\", tone=\"success\")","invocation_id":0}],"renderings":[[{"type":"markdown","data":"# Checkout timeouts","language":null,"style":{},"external_link":null,"internal_link":null,"alt":null,"focus":null,"overlays":null},{"type":"notes","data":"{\"message\": \"Share the presenter URL. This overlay is only for you.\"}","language":null,"style":{},"external_link":null,"internal_link":null,"alt":null,"focus":null,"overlays":null}],[{"type":"markdown","data":"Friday deploy. Checkout p95 jumped from 240 ms to 4.1 s. Payments stayed healthy.","language":null,"style":{},"external_link":null,"internal_link":null,"alt":null,"focus":null,"overlays":null}],[{"type":"section","data":"{\"title\": \"Symptom\", \"subtitle\": \"Only checkout, only after the cache change\"}","language":null,"style":{},"external_link":null,"internal_link":null,"alt":null,"focus":null,"overlays":null}],[{"type":"callout","data":"{\"message\": \"Health checks stayed green. The queue grew behind one process-wide lock.\", \"tone\": \"danger\", \"title\": null}","language":null,"style":{},"external_link":null,"internal_link":null,"alt":null,"focus":null,"overlays":null},{"type":"notes","data":"{\"message\": \"Pause. Ask if anyone has seen a green probe hide a lock.\"}","language":null,"style":{},"external_link":null,"internal_link":null,"alt":null,"focus":null,"overlays":null}],[{"type":"section","data":"{\"title\": \"Hypothesis\", \"subtitle\": \"A cache miss serialized every cart\"}","language":null,"style":{},"external_link":null,"internal_link":null,"alt":null,"focus":null,"overlays":null}],[{"type":"code","data":"def load_cart(user_id):\n    with LOCK:\n        cached = cache.get(user_id)\n        if cached is None:\n            cached = hydrate(user_id)\n            cache.set(user_id, cached)\n        return cached\n","language":"python","style":{},"external_link":null,"internal_link":null,"alt":null,"focus":null,"overlays":null}],[{"type":"markdown","data":"The lock wrapped the read and the fill. The first miss blocked everyone else.","language":null,"style":{},"external_link":null,"internal_link":null,"alt":null,"focus":null,"overlays":null},{"type":"notes","data":"{\"message\": \"Keep long samples in constants so audience line numbers stay clean.\"}","language":null,"style":{},"external_link":null,"internal_link":null,"alt":null,"focus":null,"overlays":null}],[{"type":"section","data":"{\"title\": \"Fix\", \"subtitle\": \"Lock only the fill, and only per key\"}","language":null,"style":{},"external_link":null,"internal_link":null,"alt":null,"focus":null,"overlays":null}],[{"type":"diff","data":"{\"content\": \"--- before\\n+++ after\\n@@ -1,5 +1,8 @@\\n def load_cart(user_id):\\n-    with LOCK:\\n+    cached = cache.get(user_id)\\n+    if cached is not None:\\n+        return cached\\n+    with lock_for(user_id):\\n         cached = cache.get(user_id)\\n         if cached is None:\\n             cached = hydrate(user_id)\", \"language\": \"python\"}","language":null,"style":{},"external_link":null,"internal_link":null,"alt":null,"focus":null,"overlays":null}],[{"type":"callout","data":"{\"message\": \"p95 returned to 220 ms. Step with the keys or the bottom scrubber.\", \"tone\": \"success\", \"title\": null}","language":null,"style":{},"external_link":null,"internal_link":null,"alt":null,"focus":null,"overlays":null}]],"outputs":[""],"steps":[[[0],0,0,0,{}],[[1],1,0,0,{}],[[2],2,0,0,{}],[[3],3,0,0,{}],[[4],4,0,0,{}],[[5],5,0,0,{}],[[6],6,0,0,{}],[[7],7,0,0,{}],[[8],8,0,0,{}],[[9],9,0,0,{}]],"presentationSteps":[0,1,2,3,4,5,6,7,8,9]}