{"formatVersion":2,"files":{"presentations/browser_fixture.py":"def main():\n    text('# Browser fixture')\n    text('A stable presentation for browser tests.')\n    section('Measurements', 'Navigate by section markers')\n    text('## Results')\n    callout('Ready for the demo')"},"frames":[{"path":"presentations/browser_fixture.py","line_number":1,"function_name":"<module>","invocation_id":1},{"path":"presentations/browser_fixture.py","line_number":2,"function_name":"main","invocation_id":2},{"path":"presentations/browser_fixture.py","line_number":3,"function_name":"main"},{"path":"presentations/browser_fixture.py","line_number":4,"function_name":"main"},{"path":"presentations/browser_fixture.py","line_number":5,"function_name":"main"},{"path":"presentations/browser_fixture.py","line_number":6,"function_name":"main"}],"renderings":[[{"type":"markdown","data":"# Browser fixture","style":{}},{"type":"notes","data":"{\"message\":\"Welcome the audience and introduce the fixture.\"}","style":{}}],[{"type":"markdown","data":"A stable presentation for browser tests.","style":{}}],[{"type":"section","data":"{\"title\":\"Measurements\",\"subtitle\":\"Navigate by section markers\"}","style":{}}],[{"type":"markdown","data":"## Results","style":{}}],[{"type":"callout","data":"{\"title\":\"Complete\",\"message\":\"Ready for the demo\",\"tone\":\"success\"}","style":{}}]],"outputs":["fixture ready\n","sample warning\n","second step\n",""],"steps":[[[0,1],0,0,1,{"audience":"engineers","demo_count":3}],[[2],1,2,3,{}],[[3],2,3,3,{}],[[4],3,3,3,{}],[[5],4,3,3,{}]]}